Name,Email Id
Jane Hill Baker Martin,jane-hill-baker.martin@xyz.com
Michael Nguyen Allen Brown,michael-nguyen-allen.brown@xyz.com
James Young Torres Adams Green Garcia,james-young-torres-adams-green.garcia@xyz.com
Emily Carter Garcia,emily-carter.garcia@xyz.com
Henry Lee Wright Rodriguez,henry-lee-wright.rodriguez@xyz.com
David Wright Jones,david-wright.jones@xyz.com
Alex Flores Nelson Smith,alex-flores-nelson.smith@xyz.com
James Lee Adams Clark Smith,james-lee-adams-clark.smith@xyz.com
Henry Lewis Green Mitchell Wilson,henry-lewis-green-mitchell.wilson@xyz.com
David Mitchell Garcia,david-mitchell.garcia@xyz.com
Daniel Torres Smith,daniel-torres.smith@xyz.com
Emma Lee Jones,emma-lee.jones@xyz.com
Henry Nguyen Lewis Martin,henry-nguyen-lewis.martin@xyz.com
Daniel Clark Young Allen Jones,daniel-clark-young-allen.jones@xyz.com
David Torres Lewis Young Hill Taylor,david-torres-lewis-young-hill.taylor@xyz.com
Sophia King Young Brown,sophia-king-young.brown@xyz.com
Emma Carter Torres Mitchell Rodriguez,emma-carter-torres-mitchell.rodriguez@xyz.com
Jane Carter Mitchell Flores Martinez,jane-carter-mitchell-flores.martinez@xyz.com
Thomas Lewis Williams,thomas-lewis.williams@xyz.com
Anna Green Flores Hall Baker Smith,anna-green-flores-hall-baker.smith@xyz.com
Jessica Lee King Jackson,jessica-lee-king.jackson@xyz.com
Emily Hall Allen Martin,emily-hall-allen.martin@xyz.com
Daniel Lee Hernandez,daniel-lee.hernandez@xyz.com
Michael Adams Hill Gonzalez,michael-adams-hill.gonzalez@xyz.com
Sarah Allen King Rodriguez,sarah-allen-king.rodriguez@xyz.com
Emma Flores Nelson Taylor,emma-flores-nelson.taylor@xyz.com
Daniel Hill Carter Mitchell Gonzalez,daniel-hill-carter-mitchell.gonzalez@xyz.com
Anna Flores King Wright Wilson,anna-flores-king-wright.wilson@xyz.com
Sophia Hall Martin,sophia-hall.martin@xyz.com
David Green Green Miller,david-green-green.miller@xyz.com
Henry Green Lewis Allen Taylor,henry-green-lewis-allen.taylor@xyz.com
John Torres Williams,john-torres.williams@xyz.com
Anna Allen Hall Martinez,anna-allen-hall.martinez@xyz.com
Alex Nguyen Hall Davis,alex-nguyen-hall.davis@xyz.com
Laura Adams Torres Mitchell Adams Smith,laura-adams-torres-mitchell-adams.smith@xyz.com
Thomas Young Mitchell Nelson Smith,thomas-young-mitchell-nelson.smith@xyz.com
Thomas King Adams Torres Adams Taylor,thomas-king-adams-torres-adams.taylor@xyz.com
Olivia Nelson Hill Lopez,olivia-nelson-hill.lopez@xyz.com
Jane Torres Lewis Anderson,jane-torres-lewis.anderson@xyz.com
Jessica Wright Lewis Anderson,jessica-wright-lewis.anderson@xyz.com
Charles Flores Brown,charles-flores.brown@xyz.com
Robert Nelson Rodriguez,robert-nelson.rodriguez@xyz.com
Robert Lee Baker Walker Miller,robert-lee-baker-walker.miller@xyz.com
Daniel Mitchell Davis,daniel-mitchell.davis@xyz.com
Olivia Anderson,olivia.anderson@xyz.com
Sophia Mitchell Mitchell Torres Gonzalez,sophia-mitchell-mitchell-torres.gonzalez@xyz.com
Alex Allen Scott Baker Moore,alex-allen-scott-baker.moore@xyz.com
Robert Flores Wright Gonzalez,robert-flores-wright.gonzalez@xyz.com
Thomas Lewis Torres Anderson,thomas-lewis-torres.anderson@xyz.com
Emily Clark Clark Young Brown,emily-clark-clark-young.brown@xyz.com
Jessica Nelson Adams Jones,jessica-nelson-adams.jones@xyz.com
Jane Baker Lee Jones,jane-baker-lee.jones@xyz.com
Daniel King Allen Flores Lee Johnson,daniel-king-allen-flores-lee.johnson@xyz.com
Alex Clark Hernandez,alex-clark.hernandez@xyz.com
Charles Scott Scott Clark Young Taylor,charles-scott-scott-clark-young.taylor@xyz.com
Laura Torres Lewis Davis,laura-torres-lewis.davis@xyz.com
Maria Hill Lewis Lewis Nguyen Thomas,maria-hill-lewis-lewis-nguyen.thomas@xyz.com
Olivia Adams Johnson,olivia-adams.johnson@xyz.com
Robert Baker Walker Young Clark Lopez,robert-baker-walker-young-clark.lopez@xyz.com
John King Nguyen Baker Miller,john-king-nguyen-baker.miller@xyz.com
Charles Lopez,charles.lopez@xyz.com
Laura Clark Wright Rodriguez,laura-clark-wright.rodriguez@xyz.com
Sophia Scott Moore,sophia-scott.moore@xyz.com
Anna Wright Hall Miller,anna-wright-hall.miller@xyz.com
Anna Lee Young Carter Flores Moore,anna-lee-young-carter-flores.moore@xyz.com
John Young Allen Torres Carter Lopez,john-young-allen-torres-carter.lopez@xyz.com
James Green Scott King Miller,james-green-scott-king.miller@xyz.com
Daniel Clark Brown,daniel-clark.brown@xyz.com
Maria Carter Jackson,maria-carter.jackson@xyz.com
Jane Flores Williams,jane-flores.williams@xyz.com
Olivia Young Nguyen Scott Rodriguez,olivia-young-nguyen-scott.rodriguez@xyz.com
Laura Carter Jones,laura-carter.jones@xyz.com
Maria Carter Mitchell Young Williams,maria-carter-mitchell-young.williams@xyz.com
Thomas Flores Baker Hall Williams,thomas-flores-baker-hall.williams@xyz.com
Thomas Green Moore,thomas-green.moore@xyz.com
David Nelson King Adams Anderson,david-nelson-king-adams.anderson@xyz.com
John Baker Clark Baker Anderson,john-baker-clark-baker.anderson@xyz.com
John Lewis Walker Hall Walker Taylor,john-lewis-walker-hall-walker.taylor@xyz.com
Henry Lee Walker Walker Taylor,henry-lee-walker-walker.taylor@xyz.com
Maria Clark Lewis Hill Jones,maria-clark-lewis-hill.jones@xyz.com
Olivia Carter Smith,olivia-carter.smith@xyz.com
Sarah Green Thomas,sarah-green.thomas@xyz.com
Jane Walker Jackson,jane-walker.jackson@xyz.com
Jessica Young Nelson Walker Miller,jessica-young-nelson-walker.miller@xyz.com
Anna Nguyen King Walker Allen Rodriguez,anna-nguyen-king-walker-allen.rodriguez@xyz.com
Robert Green Baker Mitchell Miller,robert-green-baker-mitchell.miller@xyz.com
Alex Mitchell Nelson Torres Brown,alex-mitchell-nelson-torres.brown@xyz.com
Daniel King Carter Gonzalez,daniel-king-carter.gonzalez@xyz.com
David Walker Flores Wright Scott Smith,david-walker-flores-wright-scott.smith@xyz.com
Charles Scott Mitchell Lopez,charles-scott-mitchell.lopez@xyz.com
Thomas Carter Torres Baker Mitchell Gonzalez,thomas-carter-torres-baker-mitchell.gonzalez@xyz.com
Olivia Young Lee Garcia,olivia-young-lee.garcia@xyz.com
Jessica King Martinez,jessica-king.martinez@xyz.com
Michael Allen Flores Adams Lewis Martinez,michael-allen-flores-adams-lewis.martinez@xyz.com
Emily Lewis Jackson,emily-lewis.jackson@xyz.com
Emma Green Lewis Green Young Smith,emma-green-lewis-green-young.smith@xyz.com
Charles Young Nguyen Nguyen Brown,charles-young-nguyen-nguyen.brown@xyz.com
David Allen Lopez,david-allen.lopez@xyz.com
Alex Wright Lopez,alex-wright.lopez@xyz.com
Jessica Green King Hill Lee Anderson,jessica-green-king-hill-lee.anderson@xyz.com
